{
  "format": "ma3sc-rig",
  "version": 1,
  "source": { "file": "hand-written demo rig (replace fids with 4 fixtures of your test show)" },
  "axes": { "x": "audience left -> right (seen from FOH)", "y": "downstage -> upstage", "z": "up", "unit": "mm" },
  "fixtures": [
    { "fid": 101, "name": "Spot 1", "type": "Demo Spot", "class": "Spots", "pos": [-3000, 2000, 4000], "rot": [0, 0, 0], "caps": ["dimmer", "pan", "tilt", "color_mix"] },
    { "fid": 102, "name": "Spot 2", "type": "Demo Spot", "class": "Spots", "pos": [-1000, 2000, 4000], "rot": [0, 0, 0], "caps": ["dimmer", "pan", "tilt", "color_mix"] },
    { "fid": 103, "name": "Spot 3", "type": "Demo Spot", "class": "Spots", "pos": [1000, 2000, 4000], "rot": [0, 0, 0], "caps": ["dimmer", "pan", "tilt", "color_mix"] },
    { "fid": 104, "name": "Spot 4", "type": "Demo Spot", "class": "Spots", "pos": [3000, 2000, 4000], "rot": [0, 0, 0], "caps": ["dimmer", "pan", "tilt", "color_mix"] }
  ],
  "sets": { "all": [101, 102, 103, 104], "class:Spots": [101, 102, 103, 104] },
  "orderings": {
    "class:Spots": { "left_to_right": [101, 102, 103, 104], "center_out": [102, 103, 101, 104] }
  },
  "pairs": { "class:Spots": [[101, 104], [102, 103]] }
}
